{
  "$schema": "http://json-schema.org/draft-07/schema#",
  "type": "object",
  "properties": {
    "id": {
      "type": "string",
      "minLength": 1
    },
    "problem_id": {
      "type": "string",
      "minLength": 1
    },
    "type": {
      "type": "string",
      "enum": [
        "proved",
        "disproved",
        "counterexample",
        "construction",
        "computation",
        "new_bound",
        "partial_result",
        "variant_only",
        "formalized",
        "replicated",
        "retracted",
        "contested"
      ]
    },
    "status": {
      "type": "string",
      "enum": [
        "open",
        "attempted",
        "partial",
        "candidate",
        "resolved",
        "contested",
        "retracted"
      ]
    },
    "occurred_at": {
      "anyOf": [
        {
          "type": "string",
          "format": "date-time",
          "pattern": "^(?:(?:\\d\\d[2468][048]|\\d\\d[13579][26]|\\d\\d0[48]|[02468][048]00|[13579][26]00)-02-29|\\d{4}-(?:(?:0[13578]|1[02])-(?:0[1-9]|[12]\\d|3[01])|(?:0[469]|11)-(?:0[1-9]|[12]\\d|30)|(?:02)-(?:0[1-9]|1\\d|2[0-8])))T(?:(?:[01]\\d|2[0-3]):[0-5]\\d(?::[0-5]\\d(?:\\.\\d+)?)?(?:Z))$"
        },
        {
          "type": "null"
        }
      ]
    },
    "title": {
      "type": "string",
      "minLength": 1
    },
    "summary": {
      "type": "string",
      "minLength": 1
    },
    "ai_contribution": {
      "type": "string",
      "enum": [
        "ai_discovered",
        "ai_co_developed",
        "ai_assisted",
        "ai_checked_only",
        "unclear",
        "not_applicable"
      ]
    },
    "attempt_ids": {
      "type": "array",
      "items": {
        "type": "string"
      }
    },
    "method_family_ids": {
      "type": "array",
      "items": {
        "type": "string"
      }
    },
    "source_assertion_ids": {
      "type": "array",
      "items": {
        "type": "string"
      }
    }
  },
  "required": [
    "id",
    "problem_id",
    "type",
    "status",
    "occurred_at",
    "title",
    "summary",
    "ai_contribution",
    "attempt_ids",
    "method_family_ids",
    "source_assertion_ids"
  ],
  "additionalProperties": false
}
